{
  "command": "start",
  "cli_version": "0.0.0-dev",
  "ok": true,
  "summary": "Started a testbed (stub-ui 1.0.0 default, stub-window 1.0.0 default); it is not verified: run automap verify.",
  "warnings": [],
  "failures": [],
  "files_written": [
    ".agents/skills/automap/SKILL.md",
    ".claude/skills/automap/SKILL.md",
    "AGENTS.md",
    "CLAUDE.md",
    "CMakeLists.txt",
    "automap.lock.json",
    "automap.manifest.json",
    "cmake/automap/automap.cmake",
    "cmake/automap/stub-ui.cmake",
    "cmake/automap/stub-window.cmake",
    "glue/automap/alloc.cpp",
    "glue/automap/alloc.h",
    "glue/automap/choices.h",
    "glue/automap/context.h",
    "glue/automap/diag.cpp",
    "glue/automap/diag.h",
    "glue/automap/lifecycle.cpp",
    "glue/automap/lifecycle.h",
    "glue/automap/probe.cpp",
    "glue/automap/probe.h",
    "glue/automap/startup.cpp",
    "glue/automap/startup.h",
    "glue/stub-ui--stub-window/stub_ui_stub_window.cpp",
    "glue/stub-ui--stub-window/stub_ui_stub_window.h",
    "glue/stub-ui--stub-window/stub_ui_stub_window_probe.cpp",
    "glue/stub-ui/stub_ui_allocation.cpp",
    "glue/stub-ui/stub_ui_allocation.h",
    "glue/stub-ui/stub_ui_allocation_probe.cpp",
    "glue/stub-ui/stub_ui_diagnostics.cpp",
    "glue/stub-ui/stub_ui_diagnostics_probe.cpp",
    "glue/stub-ui/stub_ui_setup.cpp",
    "glue/stub-ui/stub_ui_setup.h",
    "glue/stub-window/stub_window_allocation.cpp",
    "glue/stub-window/stub_window_allocation.h",
    "glue/stub-window/stub_window_allocation_probe.cpp",
    "glue/stub-window/stub_window_diagnostics.cpp",
    "glue/stub-window/stub_window_diagnostics_probe.cpp",
    "glue/stub-window/stub_window_setup.cpp",
    "glue/stub-window/stub_window_setup.h",
    "main.cpp",
    "vcpkg-configuration.json",
    "vcpkg.json"
  ]
}
